entity,aggregated_entities,raw_entity_types,paragraph,paper,section,uid,definition,semantic_type,taxonomy,paper_frequency,entity_type,entity_type_label
nephropathy,"['nephropathy', 'nephropathy']","['DISEASE', 'DISEASE', 'DISEASE', 'DISEASE']","{'214924:Angiotensin-Converting Enzyme 2 Expression In Diabetes Mellitus And Its Role In Covid-19 Infectivity ::: Elucidating The Crosstalk Between Covid-19 And Diabetes Mellitus:16', '197804:Management Of Children And Young People With Diabetes Mellitus That Were Covid-19 Positive:28'}","{'214924', '197804'}","{'197804:Management Of Children And Young People With Diabetes Mellitus That Were Covid-19 Positive', '214924:Angiotensin-Converting Enzyme 2 Expression In Diabetes Mellitus And Its Role In Covid-19 Infectivity '}",http://purl.obolibrary.org/obo/NCIT_C34843,A term referring to any disease affecting the kidneys.,Disease or Syndrome,"[('http://purl.obolibrary.org/obo/NCIT_C27600', 'Non-Neoplastic Kidney Disorder'), ('http://purl.obolibrary.org/obo/NCIT_C3149', 'Kidney Disorder'), ('http://purl.obolibrary.org/obo/NCIT_C3430', 'Urinary System Disorder'), ('http://purl.obolibrary.org/obo/NCIT_C156660', 'Genitourinary System Disorder'), ('http://purl.obolibrary.org/obo/NCIT_C27551', 'Disorder by Site'), ('http://purl.obolibrary.org/obo/NCIT_C2991', 'Disease or Disorder'), ('http://purl.obolibrary.org/obo/NCIT_C7057', 'Disease, Disorder or Finding'), ('http://www.w3.org/2002/07/owl#Thing', ''), ('http://purl.obolibrary.org/obo/NCIT_C27599', 'Non-Neoplastic Urinary System Disorder'), ('http://purl.obolibrary.org/obo/NCIT_C156664', 'Non-Neoplastic Genitourinary System Disorder'), ('http://purl.obolibrary.org/obo/NCIT_C53531', 'Non-Neoplastic Disorder by Site'), ('http://purl.obolibrary.org/obo/NCIT_C53529', 'Non-Neoplastic Disorder')]",2,DISEASE,DISEASE
neutrophil,"['neutrophil', 'neutrophil', 'neutrophils', 'neutrophils', 'neutrophils']","['CELL_TYPE', 'CELL_TYPE', 'CELL_TYPE', 'CELL_TYPE', 'CELL_TYPE', 'CELL_TYPE', 'CELL_TYPE', 'CELL_TYPE', 'CELL_TYPE', 'CELL_TYPE', 'CELL_TYPE', 'CELL_TYPE', 'CELL_TYPE', 'CELL_TYPE', 'CELL_TYPE', 'CELL_TYPE']","{'214924:Diabetes Mellitus And Covid-19: In The Eye Of The “Cytokine Storm” ::: Elucidating The Crosstalk Between Covid-19 And Diabetes Mellitus:20', '35198:Abstract:1', '211125:Introduction:6', '104188:Abstract:1', '211125:Caption:31', '214924:The Protective Role Of Angiotensin-Converting Enzyme 2 Against Lung Injury ::: Covid-19 Pathogenesis:11'}","{'211125', '214924', '35198', '104188'}","{'211125:Caption', '35198:Abstract', '211125:Introduction', '214924:The Protective Role Of Angiotensin-Converting Enzyme 2 Against Lung Injury ', '214924:Diabetes Mellitus And Covid-19', '104188:Abstract'}",http://purl.obolibrary.org/obo/NCIT_C12533,"Granular leukocytes having a nucleus with three to five lobes connected by slender threads of chromatin, and cytoplasm containing fine inconspicuous granules and stainable by neutral dyes.",Cell,"[('http://purl.obolibrary.org/obo/NCIT_C12530', 'Granulocyte'), ('http://purl.obolibrary.org/obo/NCIT_C12549', 'Myeloid Cell'), ('http://purl.obolibrary.org/obo/NCIT_C32725', 'Hematopoietic and Lymphoid Cell'), ('http://purl.obolibrary.org/obo/NCIT_C12508', 'Cell'), ('http://purl.obolibrary.org/obo/NCIT_C21599', 'Microanatomic Structure'), ('http://purl.obolibrary.org/obo/NCIT_C12219', 'Anatomic Structure, System, or Substance'), ('http://www.w3.org/2002/07/owl#Thing', ''), ('http://purl.obolibrary.org/obo/NCIT_C12529', 'Leukocyte'), ('http://purl.obolibrary.org/obo/NCIT_C12519', 'Peripheral Blood Cell')]",4,CELL_TYPE,CELL_TYPE
obesity,"['obesity', 'obesity']","['DISEASE', 'DISEASE', 'DISEASE', 'DISEASE', 'DISEASE', 'DISEASE', 'DISEASE', 'DISEASE', 'DISEASE', 'DISEASE', 'DISEASE', 'DISEASE', 'DISEASE', 'DISEASE', 'DISEASE', 'DISEASE', 'DISEASE', 'DISEASE', 'DISEASE', 'DISEASE', 'DISEASE', 'DISEASE', 'DISEASE', 'DISEASE', 'DISEASE', 'DISEASE', 'DISEASE', 'DISEASE', 'DISEASE', 'DISEASE', 'DISEASE', 'DISEASE', 'DISEASE', 'DISEASE', 'DISEASE', 'DISEASE', 'DISEASE', 'DISEASE', 'DISEASE', 'DISEASE']","{'184360:Cardiovascular Effects Of Sdpp4 Upregulation ::: Raas And Sdpp4 In Diabetes And Other Comorbidities:24', '184360:Diabetes As Promoter Of Severity And Mortality In Covid-19 ::: Introduction:3', '184360:Diabetes As Promoter Of Severity And Mortality In Covid-19 ::: Introduction:4', '184360:Pathophysiology Of Covid-19: Pulmonar And Cardiovascular Complications ::: Introduction:11', '184360:Pathophysiology Of Covid-19: Pulmonar And Cardiovascular Complications ::: Introduction:14', '184360:Diabetes As Promoter Of Severity And Mortality In Covid-19 ::: Introduction:5', '184360:Cardiovascular Effects Of Sdpp4 Upregulation ::: Raas And Sdpp4 In Diabetes And Other Comorbidities:25', '184360:Cardiovascular Effects Of Sdpp4 Upregulation ::: Raas And Sdpp4 In Diabetes And Other Comorbidities:27', '184360:Conclusion:63', '214924:The Interplay Between Covid-19 And Ampk/Mtor Signaling Pathway In Diabetes Mellitus ::: Elucidating The Crosstalk Between Covid-19 And Diabetes Mellitus:24', '184360:Caption:71', '214924:Introduction:6', '78884:Abstract:1', '211125:Introduction:5'}","{'78884', '184360', '211125', '214924'}","{'184360:Caption', '78884:Abstract', '214924:Introduction', '184360:Pathophysiology Of Covid-19', '184360:Conclusion', '184360:Diabetes As Promoter Of Severity And Mortality In Covid-19 ', '211125:Introduction', '184360:Cardiovascular Effects Of Sdpp4 Upregulation ', '214924:The Interplay Between Covid-19 And Ampk/Mtor Signaling Pathway In Diabetes Mellitus '}",http://purl.obolibrary.org/obo/NCIT_C159658,"Weighing well above a person's ideal weight, generally characterized as a Body Mass Index (BMI) of 30 and above.",Qualitative Concept,"[('http://purl.obolibrary.org/obo/NCIT_C27992', 'Disease Qualifier'), ('http://purl.obolibrary.org/obo/NCIT_C41009', 'Qualifier'), ('http://purl.obolibrary.org/obo/NCIT_C20189', 'Property or Attribute'), ('http://www.w3.org/2002/07/owl#Thing', '')]",4,DISEASE,DISEASE
oral cavity,"['oral', 'oral', 'oral']","['ORGAN', 'ORGAN', 'DRUG', 'ORGAN', 'ORGAN', 'DRUG', 'DRUG', 'DRUG', 'DRUG', 'DRUG', 'ORGAN', 'ORGAN', 'DRUG', 'ORGAN', 'ORGAN', 'DRUG', 'DRUG', 'DRUG', 'DRUG', 'DRUG', 'ORGAN', 'ORGAN', 'DRUG', 'ORGAN', 'ORGAN', 'DRUG', 'DRUG', 'DRUG', 'DRUG', 'DRUG']","{'211125:Study Design And Participants:8', '184360:Gliptins ::: Therapeutic Potential Of Targeting Dpp4 In Diabetic Patients With Covid-19:41', '179426:Role Of Antidiabetic Drugs In Current Context ::: Special Aspects Of Pathophysiology Of Diabetes And Relationship Of Anti-Diabetic Drugs In The Context Of Covid-19:12', '197804:Discussion:39', '211125:Discussion:27', '179426:Glycemic Control ::: Special Aspects Of Management Of Diabetes With Covid-19:18', '211125:Caption:31', '179426:Glycemic Control ::: Special Aspects Of Management Of Diabetes With Covid-19:17'}","{'179426', '184360', '211125', '197804'}","{'197804:Discussion', '211125:Caption', '211125:Study Design And Participants', '184360:Gliptins ', '179426:Role Of Antidiabetic Drugs In Current Context ', '211125:Discussion', '179426:Glycemic Control '}",http://purl.obolibrary.org/obo/NCIT_C12421,"The cavity located at the upper end of the alimentary canal, behind the teeth and gums that is bounded on the outside by the lips, above by the hard and soft palates and below by the tongue.","Body Part, Organ, or Organ Component","[('http://purl.obolibrary.org/obo/NCIT_C25444', 'Body Cavity'), ('http://purl.obolibrary.org/obo/NCIT_C12219', 'Anatomic Structure, System, or Substance'), ('http://www.w3.org/2002/07/owl#Thing', '')]",4,ORGAN,ORGAN
organ,"['organ', 'organs']","['ORGAN', 'ORGAN', 'ORGAN', 'ORGAN', 'ORGAN', 'ORGAN']","{'211125:Study Design And Participants:10', '214924:Angiotensin-Converting Enzyme 2 Expression In Diabetes Mellitus And Its Role In Covid-19 Infectivity ::: Elucidating The Crosstalk Between Covid-19 And Diabetes Mellitus:18', '211125:General Characteristics Of Patients With Covid-19:18', '211125:Discussion:29'}","{'211125', '214924'}","{'211125:Study Design And Participants', '214924:Angiotensin-Converting Enzyme 2 Expression In Diabetes Mellitus And Its Role In Covid-19 Infectivity ', '211125:Discussion', '211125:General Characteristics Of Patients With Covid-19'}",http://purl.obolibrary.org/obo/NCIT_C13018,"A unique macroscopic (gross) anatomic structure that performs specific functions. It is composed of various tissues.  An organ is part of an anatomic system or a body region. Representative examples include the heart, lung, liver, spleen, and uterus.","Body Part, Organ, or Organ Component","[('http://purl.obolibrary.org/obo/NCIT_C12219', 'Anatomic Structure, System, or Substance'), ('http://www.w3.org/2002/07/owl#Thing', '')]",2,ORGAN,ORGAN
oxygen,"['oxygen', 'oxygen', 'oxygen', 'oxygen']","['CHEMICAL', 'CHEMICAL', 'CHEMICAL', 'CHEMICAL', 'CHEMICAL', 'CHEMICAL', 'CHEMICAL', 'CHEMICAL']","{'197804:Discussion:41', '211125:Study Design And Participants:9'}","{'211125', '197804'}","{'197804:Discussion', '211125:Study Design And Participants'}",http://purl.obolibrary.org/obo/NCIT_C722,"An element with atomic symbol O, atomic number 8, and atomic weight 16.",Pharmacologic Substance,"[('http://purl.obolibrary.org/obo/NCIT_C1940', 'Element'), ('http://purl.obolibrary.org/obo/NCIT_C579', 'Inorganic Chemical'), ('http://purl.obolibrary.org/obo/NCIT_C1913', 'Drug or Chemical by Structure'), ('http://purl.obolibrary.org/obo/NCIT_C1908', 'Drug, Food, Chemical or Biomedical Material'), ('http://www.w3.org/2002/07/owl#Thing', '')]",2,CHEMICAL,CHEMICAL
person,"['individuals', 'individuals']","['ORGANISM', 'ORGANISM', 'ORGANISM', 'ORGANISM', 'ORGANISM', 'ORGANISM', 'ORGANISM', 'ORGANISM', 'ORGANISM', 'ORGANISM', 'ORGANISM', 'ORGANISM', 'ORGANISM', 'ORGANISM', 'ORGANISM', 'ORGANISM', 'ORGANISM', 'ORGANISM']","{'197804:Caption:67', '184360:Pathophysiology Of Covid-19: Pulmonar And Cardiovascular Complications ::: Introduction:11', '197804:Discussion:50', '214924:Introduction:4', '214728:Cap Community-Acquired Pneumonia Covid-19 Coronavirus Disease-2019:1', '214924:Diabetes Mellitus: A Risk Factor For The Progression Of Covid-19:13', '197804:Discussion:33'}","{'214728', '184360', '214924', '197804'}","{'197804:Discussion', '214924:Introduction', '214924:Diabetes Mellitus', '214728:Cap Community-Acquired Pneumonia Covid-19 Coronavirus Disease-2019', '184360:Pathophysiology Of Covid-19', '197804:Caption'}",http://purl.obolibrary.org/obo/NCIT_C25190,A human being.,Human,"[('http://purl.obolibrary.org/obo/NCIT_C20181', 'Conceptual Entity'), ('http://www.w3.org/2002/07/owl#Thing', '')]",4,ORGANISM,ORGANISM
plasma,"['plasma', 'plasma', 'plasma']","['ORGAN', 'ORGAN', 'ORGAN', 'ORGAN', 'ORGAN', 'ORGAN', 'ORGAN', 'ORGAN', 'ORGAN', 'ORGAN', 'ORGAN', 'ORGAN', 'ORGAN', 'ORGAN', 'ORGAN', 'ORGAN', 'ORGAN', 'ORGAN', 'ORGAN', 'ORGAN', 'ORGAN', 'ORGAN', 'ORGAN', 'ORGAN']","{'184360:Aceis And Arbs ::: Therapeutic Potential Of Raas-Targeted Drugs In Diabetic Patients With Covid-19:34', '214924:The Immune Response To Sars-Cov-2 ::: Covid-19 Pathogenesis:10', '184360:Sdpp4 As Soluble Decoy Factor ::: Therapeutic Potential Of Targeting Dpp4 In Diabetic Patients With Covid-19:53', '211125:Introduction:7', '184360:Anti-Dpp4 Vaccine ::: Therapeutic Potential Of Targeting Dpp4 In Diabetic Patients With Covid-19:55', '214924:Diabetes Mellitus: A Risk Factor For The Progression Of Covid-19:13'}","{'184360', '211125', '214924'}","{'214924:Diabetes Mellitus', '184360:Anti-Dpp4 Vaccine ', '184360:Sdpp4 As Soluble Decoy Factor ', '214924:The Immune Response To Sars-Cov-2 ', '184360:Aceis And Arbs ', '211125:Introduction'}",http://purl.obolibrary.org/obo/NCIT_C13356,"Plasma is the fluid (noncellular) portion of the circulating blood, as distinguished from the serum that is the fluid portion of the blood obtained by removal of the fibrin clot and blood cells after coagulation.",Body Substance,"[('http://purl.obolibrary.org/obo/NCIT_C13236', 'Body Fluid or Substance'), ('http://purl.obolibrary.org/obo/NCIT_C12219', 'Anatomic Structure, System, or Substance'), ('http://www.w3.org/2002/07/owl#Thing', '')]",3,ORGAN,ORGAN
plasmid,"['plasmin', 'plasmin', 'plasmin']","['PROTEIN', 'PROTEIN', 'PROTEIN', 'PROTEIN', 'PROTEIN', 'PROTEIN', 'PROTEIN', 'PROTEIN', 'PROTEIN', 'PROTEIN', 'PROTEIN', 'PROTEIN']","{'214924:Diabetes Mellitus: A Risk Factor For The Progression Of Covid-19:13', '184360:Cardiovascular Effects Of Sdpp4 Upregulation ::: Raas And Sdpp4 In Diabetes And Other Comorbidities:29'}","{'184360', '214924'}","{'214924:Diabetes Mellitus', '184360:Cardiovascular Effects Of Sdpp4 Upregulation '}",http://purl.obolibrary.org/obo/NCIT_C754,A small cellular inclusion consisting of a ring of DNA that is not in a chromosome but is capable of autonomous replication.,"Nucleic Acid, Nucleoside, or Nucleotide","[('http://purl.obolibrary.org/obo/NCIT_C449', 'DNA'), ('http://purl.obolibrary.org/obo/NCIT_C706', 'Nucleic Acids'), ('http://purl.obolibrary.org/obo/NCIT_C708', 'Nucleic Acids, Nucleosides, and Nucleotides'), ('http://purl.obolibrary.org/obo/NCIT_C718', 'Organic Chemical'), ('http://purl.obolibrary.org/obo/NCIT_C1913', 'Drug or Chemical by Structure'), ('http://purl.obolibrary.org/obo/NCIT_C1908', 'Drug, Food, Chemical or Biomedical Material'), ('http://www.w3.org/2002/07/owl#Thing', '')]",2,CHEMICAL,CHEMICAL
pneumonia,"['pneumonia', 'pneumonia', 'pneumonia']","['DISEASE', 'DISEASE', 'DISEASE', 'DISEASE', 'DISEASE', 'DISEASE', 'DISEASE', 'DISEASE', 'DISEASE', 'DISEASE', 'DISEASE', 'DISEASE', 'DISEASE', 'DISEASE', 'DISEASE', 'DISEASE', 'DISEASE', 'DISEASE', 'DISEASE', 'DISEASE', 'DISEASE', 'DISEASE', 'DISEASE', 'DISEASE', 'DISEASE', 'DISEASE', 'DISEASE', 'DISEASE', 'DISEASE', 'DISEASE', 'DISEASE', 'DISEASE', 'DISEASE', 'DISEASE', 'DISEASE', 'DISEASE', 'DISEASE', 'DISEASE', 'DISEASE', 'DISEASE', 'DISEASE', 'DISEASE', 'DISEASE', 'DISEASE', 'DISEASE', 'DISEASE', 'DISEASE', 'DISEASE', 'DISEASE', 'DISEASE', 'DISEASE']","{'179426:Morbidity And Mortality In Diabetic Cohorts With Covid-19:10', '214728:Cap Community-Acquired Pneumonia Covid-19 Coronavirus Disease-2019:3', '197804:Discussion:41', '179426:Role Of Antidiabetic Drugs In Current Context ::: Special Aspects Of Pathophysiology Of Diabetes And Relationship Of Anti-Diabetic Drugs In The Context Of Covid-19:12', '184360:Aceis And Arbs ::: Therapeutic Potential Of Raas-Targeted Drugs In Diabetic Patients With Covid-19:33', '160564:Introduction:3', '211125:Discussion:23', '214924:Introduction:3', '114119:Abstract:1', '179426:Role Of Dpp4 Enzyme And Dpp4 Inhibitors ::: Special Aspects Of Pathophysiology Of Diabetes And Relationship Of Anti-Diabetic Drugs In The Context Of Covid-19:16', '214924:Diabetes Mellitus: A Risk Factor For The Progression Of Covid-19:13', '214924:Introduction:6', '197804:Discussion:42', '179426:Role Of Statins, Calcium Channel Blockers And Aspirin ::: Special Aspects Of Management Of Diabetes With Covid-19:21', '179426:Role Of Statins, Calcium Channel Blockers And Aspirin ::: Special Aspects Of Management Of Diabetes With Covid-19:22'}","{'184360', '214728', '160564', '197804', '214924', '179426', '211125', '114119'}","{'197804:Discussion', '160564:Introduction', '214924:Introduction', '214924:Diabetes Mellitus', '214728:Cap Community-Acquired Pneumonia Covid-19 Coronavirus Disease-2019', '179426:Morbidity And Mortality In Diabetic Cohorts With Covid-19', '114119:Abstract', '179426:Role Of Antidiabetic Drugs In Current Context ', '179426:Role Of Dpp4 Enzyme And Dpp4 Inhibitors ', '179426:Role Of Statins, Calcium Channel Blockers And Aspirin ', '211125:Discussion', '184360:Aceis And Arbs '}",http://purl.obolibrary.org/obo/NCIT_C3333,"An acute, acute and chronic, or chronic inflammation focally or diffusely affecting the lung parenchyma, due to infections (viruses, fungi, mycoplasma, or bacteria), treatment (e.g. radiation), or exposure (inhalation) to chemicals. Symptoms include cough, shortness of breath, fevers, chills, chest pain, headache, sweating, and weakness.",Disease or Syndrome,"[('http://purl.obolibrary.org/obo/NCIT_C27557', 'Non-Neoplastic Lung Disorder'), ('http://purl.obolibrary.org/obo/NCIT_C35755', 'Non-Neoplastic Respiratory System Disorder'), ('http://purl.obolibrary.org/obo/NCIT_C26871', 'Respiratory System Disorder'), ('http://purl.obolibrary.org/obo/NCIT_C27669', 'Respiratory and Thoracic Disorder'), ('http://purl.obolibrary.org/obo/NCIT_C27551', 'Disorder by Site'), ('http://purl.obolibrary.org/obo/NCIT_C2991', 'Disease or Disorder'), ('http://purl.obolibrary.org/obo/NCIT_C7057', 'Disease, Disorder or Finding'), ('http://www.w3.org/2002/07/owl#Thing', ''), ('http://purl.obolibrary.org/obo/NCIT_C53531', 'Non-Neoplastic Disorder by Site'), ('http://purl.obolibrary.org/obo/NCIT_C53529', 'Non-Neoplastic Disorder'), ('http://purl.obolibrary.org/obo/NCIT_C3198', 'Lung Disorder'), ('http://purl.obolibrary.org/obo/NCIT_C35742', 'Thoracic Disorder'), ('http://purl.obolibrary.org/obo/NCIT_C35743', 'Non-Neoplastic Thoracic Disorder')]",8,DISEASE,DISEASE
prognosis,"['prognosis', 'prognosis']","['DISEASE', 'DISEASE', 'DISEASE', 'DISEASE']","{'35198:Title:0', '104188:Title:0'}","{'35198', '104188'}","{'35198:Title', '104188:Title'}",http://purl.obolibrary.org/obo/NCIT_C17013,Prediction of the probable course and outcome of a disease.,Idea or Concept,"[('http://purl.obolibrary.org/obo/NCIT_C54156', 'Prediction'), ('http://purl.obolibrary.org/obo/NCIT_C20181', 'Conceptual Entity'), ('http://www.w3.org/2002/07/owl#Thing', '')]",2,DISEASE,DISEASE
proliferation,"['proliferation', 'proliferation']","['PATHWAY', 'PATHWAY', 'PATHWAY', 'PATHWAY', 'PATHWAY', 'PATHWAY', 'PATHWAY', 'PATHWAY', 'PATHWAY', 'PATHWAY', 'PATHWAY', 'PATHWAY', 'PATHWAY', 'PATHWAY', 'PATHWAY', 'PATHWAY', 'PATHWAY', 'PATHWAY', 'PATHWAY', 'PATHWAY']","{'184360:Cardiovascular Effects Of Sdpp4 Upregulation ::: Raas And Sdpp4 In Diabetes And Other Comorbidities:30', '214924:The Immune Response To Sars-Cov-2 ::: Covid-19 Pathogenesis:10', '211125:Discussion:24', '184360:Sdpp4 As Soluble Decoy Factor ::: Therapeutic Potential Of Targeting Dpp4 In Diabetic Patients With Covid-19:53', '184360:Anti-Dpp4 Vaccine ::: Therapeutic Potential Of Targeting Dpp4 In Diabetic Patients With Covid-19:55', '184360:Cardiovascular Effects Of Sdpp4 Upregulation ::: Raas And Sdpp4 In Diabetes And Other Comorbidities:25', '184360:Gliptins ::: Therapeutic Potential Of Targeting Dpp4 In Diabetic Patients With Covid-19:50', '184360:Gliptins ::: Therapeutic Potential Of Targeting Dpp4 In Diabetic Patients With Covid-19:43', '214924:The Interplay Between Covid-19 And Ampk/Mtor Signaling Pathway In Diabetes Mellitus ::: Elucidating The Crosstalk Between Covid-19 And Diabetes Mellitus:26', '214924:The Interplay Between Covid-19 And Ampk/Mtor Signaling Pathway In Diabetes Mellitus ::: Elucidating The Crosstalk Between Covid-19 And Diabetes Mellitus:22'}","{'184360', '211125', '214924'}","{'184360:Gliptins ', '184360:Anti-Dpp4 Vaccine ', '184360:Sdpp4 As Soluble Decoy Factor ', '214924:The Immune Response To Sars-Cov-2 ', '211125:Discussion', '184360:Cardiovascular Effects Of Sdpp4 Upregulation ', '214924:The Interplay Between Covid-19 And Ampk/Mtor Signaling Pathway In Diabetes Mellitus '}",http://purl.obolibrary.org/obo/NCIT_C28378,Multiplying or increasing in number.,Conceptual Entity,"[('http://purl.obolibrary.org/obo/NCIT_C25404', 'Action'), ('http://purl.obolibrary.org/obo/NCIT_C43431', 'Activity'), ('http://www.w3.org/2002/07/owl#Thing', '')]",3,PATHWAY,PATHWAY
pulmonary,"['pulmonary', 'pulmonary', 'pulmonary']","['ORGAN', 'ORGAN', 'ORGAN', 'ORGAN', 'ORGAN', 'ORGAN', 'ORGAN', 'ORGAN', 'ORGAN', 'ORGAN', 'ORGAN', 'ORGAN', 'ORGAN', 'ORGAN', 'ORGAN', 'ORGAN', 'ORGAN', 'ORGAN', 'ORGAN', 'ORGAN', 'ORGAN', 'ORGAN', 'ORGAN', 'ORGAN', 'ORGAN', 'ORGAN', 'ORGAN', 'ORGAN', 'ORGAN', 'ORGAN', 'ORGAN', 'ORGAN', 'ORGAN', 'ORGAN', 'ORGAN', 'ORGAN', 'ORGAN', 'ORGAN', 'ORGAN', 'ORGAN', 'ORGAN', 'ORGAN', 'ORGAN', 'ORGAN', 'ORGAN', 'ORGAN', 'ORGAN', 'ORGAN']","{'184360:Rhace2 As Decoy Factor ::: Therapeutic Potential Of Raas-Targeted Drugs In Diabetic Patients With Covid-19:38', '184360:Pathophysiology Of Covid-19: Pulmonar And Cardiovascular Complications ::: Introduction:7', '184360:Pathophysiology Of Covid-19: Pulmonar And Cardiovascular Complications ::: Introduction:13', '179426:Role Of Antidiabetic Drugs In Current Context ::: Special Aspects Of Pathophysiology Of Diabetes And Relationship Of Anti-Diabetic Drugs In The Context Of Covid-19:12', '184360:Pathophysiology Of Covid-19: Pulmonar And Cardiovascular Complications ::: Introduction:6', '184360:Pathophysiology Of Covid-19: Pulmonar And Cardiovascular Complications ::: Introduction:9', '214924:Angiotensin-Converting Enzyme 2 Expression In Diabetes Mellitus And Its Role In Covid-19 Infectivity ::: Elucidating The Crosstalk Between Covid-19 And Diabetes Mellitus:17', '211373:Introduction:5', '214924:The Protective Role Of Angiotensin-Converting Enzyme 2 Against Lung Injury ::: Covid-19 Pathogenesis:11', '214924:Introduction:6', '184360:Cardiovascular Effects Of Ace-Ang Ii-At1R Axis Upregulation And Ang-(1-7)/Mas Axis Dowregulation ::: Raas And Sdpp4 In Diabetes And Other Comorbidities:22', '214924:The Immune Response To Sars-Cov-2 ::: Covid-19 Pathogenesis:9'}","{'179426', '184360', '214924', '211373'}","{'211373:Introduction', '214924:Introduction', '184360:Rhace2 As Decoy Factor ', '179426:Role Of Antidiabetic Drugs In Current Context ', '184360:Pathophysiology Of Covid-19', '214924:The Immune Response To Sars-Cov-2 ', '214924:Angiotensin-Converting Enzyme 2 Expression In Diabetes Mellitus And Its Role In Covid-19 Infectivity ', '214924:The Protective Role Of Angiotensin-Converting Enzyme 2 Against Lung Injury ', '184360:Cardiovascular Effects Of Ace-Ang Ii-At1R Axis Upregulation And Ang-(1-7)/Mas Axis Dowregulation '}",http://purl.obolibrary.org/obo/NCIT_C13304,"Relating to the lungs as the intended site of administration, where the pharmaceutical product is administered, usually by inhalation, for local action in the lower respiratory tract or for systemic action after absorption via the lower respiratory tract.",Qualitative Concept,"[('http://purl.obolibrary.org/obo/NCIT_C13442', 'Anatomy Qualifier'), ('http://purl.obolibrary.org/obo/NCIT_C41009', 'Qualifier'), ('http://purl.obolibrary.org/obo/NCIT_C20189', 'Property or Attribute'), ('http://www.w3.org/2002/07/owl#Thing', '')]",4,ORGAN,ORGAN
rbd,['rbd'],"['DISEASE', 'DISEASE', 'DISEASE', 'DISEASE']","{'184360:Mechanisms Of Sars-Cov-2 Entry Into Host Cells:17', '214924:The Immune Response To Sars-Cov-2 ::: Covid-19 Pathogenesis:8', '184360:Mechanisms Of Sars-Cov-2 Entry Into Host Cells:15'}","{'184360', '214924'}","{'184360:Mechanisms Of Sars-Cov-2 Entry Into Host Cells', '214924:The Immune Response To Sars-Cov-2 '}",,,,,2,DISEASE,DISEASE
receptor binding,"['receptor binding domain', 'receptor binding domain', 'receptor binding domain', 'receptor binding domain', 'receptor binding domain']","['PROTEIN', 'PROTEIN', 'PROTEIN', 'PROTEIN', 'PROTEIN', 'PROTEIN', 'PROTEIN', 'PROTEIN', 'PROTEIN', 'PROTEIN']","{'197804:Discussion:53', '184360:Mechanisms Of Sars-Cov-2 Entry Into Host Cells:15'}","{'184360', '197804'}","{'184360:Mechanisms Of Sars-Cov-2 Entry Into Host Cells', '197804:Discussion'}",http://purl.obolibrary.org/obo/NCIT_C40536,"Receptor Binding involves a temporary non-covalent, typically highly specific and high affinity, interaction through intermolecular physical forces of attraction and spatial complementarity with a diverse group of intrinsic membrane or cytoplasmic proteins that mediate the biological effects of secreted regulatory signaling molecules through modification of the activity of signal transduction pathways.",Molecular Function,"[('http://purl.obolibrary.org/obo/NCIT_C18219', 'Molecular Interaction Process'), ('http://purl.obolibrary.org/obo/NCIT_C19986', 'Biophysical Process'), ('http://purl.obolibrary.org/obo/NCIT_C17710', 'Subcellular Process'), ('http://purl.obolibrary.org/obo/NCIT_C17828', 'Biological Process'), ('http://www.w3.org/2002/07/owl#Thing', '')]",2,PATHWAY,PATHWAY
renal,"['renal', 'renal']","['ORGAN', 'ORGAN', 'ORGAN', 'ORGAN', 'ORGAN', 'ORGAN', 'ORGAN', 'ORGAN', 'ORGAN', 'ORGAN', 'ORGAN', 'ORGAN']","{'211125:Study Design And Participants:9', '184360:Combined Therapeutic Potential Targeting Raas And Dpp4:57', '211125:Data Collection:11', '214924:Angiotensin-Converting Enzyme 2 Expression In Diabetes Mellitus And Its Role In Covid-19 Infectivity ::: Elucidating The Crosstalk Between Covid-19 And Diabetes Mellitus:14', '184360:Cardiovascular Effects Of Ace-Ang Ii-At1R Axis Upregulation And Ang-(1-7)/Mas Axis Dowregulation ::: Raas And Sdpp4 In Diabetes And Other Comorbidities:21', '184360:Combined Therapeutic Potential Targeting Raas And Dpp4:59'}","{'184360', '211125', '214924'}","{'211125:Study Design And Participants', '184360:Combined Therapeutic Potential Targeting Raas And Dpp4', '214924:Angiotensin-Converting Enzyme 2 Expression In Diabetes Mellitus And Its Role In Covid-19 Infectivity ', '211125:Data Collection', '184360:Cardiovascular Effects Of Ace-Ang Ii-At1R Axis Upregulation And Ang-(1-7)/Mas Axis Dowregulation '}",http://purl.obolibrary.org/obo/NCIT_C25225,Of or pertaining to the kidney.,Qualitative Concept,"[('http://purl.obolibrary.org/obo/NCIT_C13442', 'Anatomy Qualifier'), ('http://purl.obolibrary.org/obo/NCIT_C41009', 'Qualifier'), ('http://purl.obolibrary.org/obo/NCIT_C20189', 'Property or Attribute'), ('http://www.w3.org/2002/07/owl#Thing', '')]",3,ORGAN,ORGAN
