entity,aggregated_entities,raw_entity_types,paragraph,paper,section,uid,definition,semantic_type,taxonomy,paper_frequency,entity_type,entity_type_label
dyspnea,"['dyspnea', 'dyspnea', 'dyspnea']","['DISEASE', 'DISEASE', 'DISEASE', 'DISEASE', 'DISEASE', 'DISEASE']","{'160564:Introduction:3', '214924:Introduction:6'}","{'160564', '214924'}","{'160564:Introduction', '214924:Introduction'}",http://purl.obolibrary.org/obo/NCIT_C2998,An uncomfortable sensation of difficulty breathing. It may present as an acute or chronic sign of an underlying respiratory or heart disorder.,Sign or Symptom,"[('http://purl.obolibrary.org/obo/NCIT_C3676', 'Alteration in Respiration'), ('http://purl.obolibrary.org/obo/NCIT_C5043', 'Ventilation or Perfusion Signs and Symptoms'), ('http://purl.obolibrary.org/obo/NCIT_C100104', 'Sign or Symptom'), ('http://purl.obolibrary.org/obo/NCIT_C3367', 'Finding'), ('http://purl.obolibrary.org/obo/NCIT_C7057', 'Disease, Disorder or Finding'), ('http://www.w3.org/2002/07/owl#Thing', '')]",2,DISEASE,DISEASE
extracellular matrix,"['extracellular matrix', 'extracellular matrix', 'extracellular matrix', 'extracellular matrix']","['CELL_COMPARTMENT', 'CELL_COMPARTMENT', 'CELL_COMPARTMENT', 'CELL_COMPARTMENT', 'CELL_COMPARTMENT', 'CELL_COMPARTMENT', 'CELL_COMPARTMENT', 'CELL_COMPARTMENT']","{'211373:Introduction:4', '184360:Cardiovascular Effects Of Sdpp4 Upregulation ::: Raas And Sdpp4 In Diabetes And Other Comorbidities:28'}","{'184360', '211373'}","{'211373:Introduction', '184360:Cardiovascular Effects Of Sdpp4 Upregulation '}",http://purl.obolibrary.org/obo/NCIT_C13232,"The extracellular matrix is a network of fibers that hold cells together. It is found within the extracellular space and in association with the basement membrane of the cell surface. It promotes cellular proliferation and provides a supporting structure to which cells or cell lysates in culture dishes adhere. It is broken down during normal physiological and disease processes such as bone remodeling, embryogenesis, cancer, and arthritis.",Tissue,"[('http://purl.obolibrary.org/obo/NCIT_C12374', 'Connective Tissue'), ('http://purl.obolibrary.org/obo/NCIT_C12964', 'Connective and Soft Tissue'), ('http://purl.obolibrary.org/obo/NCIT_C12801', 'Tissue'), ('http://purl.obolibrary.org/obo/NCIT_C12219', 'Anatomic Structure, System, or Substance'), ('http://www.w3.org/2002/07/owl#Thing', ''), ('http://purl.obolibrary.org/obo/NCIT_C14136', 'Extracellular Structure'), ('http://purl.obolibrary.org/obo/NCIT_C38625', 'Tissue Part'), ('http://purl.obolibrary.org/obo/NCIT_C32221', 'Body Part')]",2,ORGAN,ORGAN
fatigue,"['fatigue', 'fatigue', 'fatigue']","['DISEASE', 'DISEASE', 'DISEASE', 'DISEASE', 'DISEASE', 'DISEASE']","{'160564:Introduction:3', '214924:Introduction:6'}","{'160564', '214924'}","{'160564:Introduction', '214924:Introduction'}",http://purl.obolibrary.org/obo/NCIT_C3036,Overall tiredness and lack of energy.,Sign or Symptom,"[('http://purl.obolibrary.org/obo/NCIT_C3858', 'Mental and Behavioral Signs and Symptoms'), ('http://purl.obolibrary.org/obo/NCIT_C100104', 'Sign or Symptom'), ('http://purl.obolibrary.org/obo/NCIT_C3367', 'Finding'), ('http://purl.obolibrary.org/obo/NCIT_C7057', 'Disease, Disorder or Finding'), ('http://www.w3.org/2002/07/owl#Thing', '')]",2,DISEASE,DISEASE
fever,"['fever', 'fever', 'fever']","['DISEASE', 'DISEASE', 'DISEASE', 'DISEASE', 'DISEASE', 'DISEASE', 'DISEASE', 'DISEASE', 'DISEASE', 'DISEASE', 'DISEASE', 'DISEASE', 'DISEASE', 'DISEASE', 'DISEASE']","{'197804:Introduction:2', '211125:Study Design And Participants:10', '214924:Introduction:6', '211125:General Characteristics Of Patients With Covid-19:17', '197804:Discussion:46'}","{'214924', '211125', '197804'}","{'197804:Discussion', '214924:Introduction', '197804:Introduction', '211125:Study Design And Participants', '211125:General Characteristics Of Patients With Covid-19'}",http://purl.obolibrary.org/obo/NCIT_C3038,Elevation of body temperature above normal due to inflammatory or immune responses.,Sign or Symptom,"[('http://purl.obolibrary.org/obo/NCIT_C53458', 'Sign'), ('http://purl.obolibrary.org/obo/NCIT_C100104', 'Sign or Symptom'), ('http://purl.obolibrary.org/obo/NCIT_C3367', 'Finding'), ('http://purl.obolibrary.org/obo/NCIT_C7057', 'Disease, Disorder or Finding'), ('http://www.w3.org/2002/07/owl#Thing', '')]",3,DISEASE,DISEASE
glucose,"['glucose', 'glucose']","['CHEMICAL', 'CHEMICAL', 'CHEMICAL', 'CHEMICAL', 'CHEMICAL', 'CHEMICAL', 'CHEMICAL', 'CHEMICAL', 'CHEMICAL', 'CHEMICAL', 'CHEMICAL', 'CHEMICAL', 'CHEMICAL', 'CHEMICAL', 'CHEMICAL', 'CHEMICAL', 'CHEMICAL', 'CHEMICAL', 'CHEMICAL', 'CHEMICAL', 'CHEMICAL', 'CHEMICAL', 'CHEMICAL', 'CHEMICAL', 'CHEMICAL', 'CHEMICAL', 'CHEMICAL', 'CHEMICAL', 'CHEMICAL', 'CHEMICAL', 'CHEMICAL', 'CHEMICAL', 'CHEMICAL', 'CHEMICAL', 'CHEMICAL', 'CHEMICAL', 'CHEMICAL', 'CHEMICAL', 'CHEMICAL', 'CHEMICAL', 'CHEMICAL', 'CHEMICAL', 'CHEMICAL', 'CHEMICAL', 'CHEMICAL', 'CHEMICAL', 'CHEMICAL', 'CHEMICAL', 'CHEMICAL', 'CHEMICAL', 'CHEMICAL', 'CHEMICAL', 'CHEMICAL', 'CHEMICAL', 'CHEMICAL', 'CHEMICAL', 'CHEMICAL', 'CHEMICAL', 'CHEMICAL', 'CHEMICAL', 'CHEMICAL', 'CHEMICAL', 'CHEMICAL', 'CHEMICAL', 'CHEMICAL', 'CHEMICAL', 'CHEMICAL', 'CHEMICAL', 'CHEMICAL', 'CHEMICAL', 'CHEMICAL', 'CHEMICAL', 'CHEMICAL', 'CHEMICAL', 'CHEMICAL', 'CHEMICAL', 'CHEMICAL', 'CHEMICAL', 'CHEMICAL', 'CHEMICAL', 'CHEMICAL', 'CHEMICAL', 'CHEMICAL', 'CHEMICAL', 'CHEMICAL', 'CHEMICAL', 'CHEMICAL', 'CHEMICAL', 'CHEMICAL', 'CHEMICAL', 'CHEMICAL', 'CHEMICAL', 'CHEMICAL', 'CHEMICAL', 'CHEMICAL', 'CHEMICAL', 'CHEMICAL', 'CHEMICAL', 'CHEMICAL', 'CHEMICAL', 'CHEMICAL', 'CHEMICAL', 'CHEMICAL', 'CHEMICAL', 'CHEMICAL', 'CHEMICAL', 'CHEMICAL', 'CHEMICAL', 'CHEMICAL', 'CHEMICAL', 'CHEMICAL', 'CHEMICAL', 'CHEMICAL', 'CHEMICAL', 'CHEMICAL', 'CHEMICAL', 'CHEMICAL', 'CHEMICAL', 'CHEMICAL', 'CHEMICAL', 'CHEMICAL', 'CHEMICAL', 'CHEMICAL', 'CHEMICAL', 'CHEMICAL', 'CHEMICAL', 'CHEMICAL', 'CHEMICAL', 'CHEMICAL', 'CHEMICAL', 'CHEMICAL', 'CHEMICAL', 'CHEMICAL', 'CHEMICAL', 'CHEMICAL', 'CHEMICAL', 'CHEMICAL', 'CHEMICAL', 'CHEMICAL', 'CHEMICAL', 'CHEMICAL', 'CHEMICAL', 'CHEMICAL', 'CHEMICAL', 'CHEMICAL', 'CHEMICAL', 'CHEMICAL', 'CHEMICAL', 'CHEMICAL', 'CHEMICAL', 'CHEMICAL', 'CHEMICAL', 'CHEMICAL', 'CHEMICAL', 'CHEMICAL', 'CHEMICAL', 'CHEMICAL', 'CHEMICAL', 'CHEMICAL', 'CHEMICAL']","{'179426:Blood Glucose Monitoring ::: Special Aspects Of Management Of Diabetes With Covid-19:19', '197804:Management Of Children And Young People With Diabetes Mellitus That Were Covid-19 Positive:27', '197804:The Survey:11', '214728:Cap Community-Acquired Pneumonia Covid-19 Coronavirus Disease-2019:6', '184360:Conclusion:63', '104188:Abstract:1', '114119:Abstract:1', '197804:Discussion:47', '214924:Angiotensin-Converting Enzyme 2 Expression In Diabetes Mellitus And Its Role In Covid-19 Infectivity ::: Elucidating The Crosstalk Between Covid-19 And Diabetes Mellitus:18', '179426:Glycemic Control ::: Special Aspects Of Management Of Diabetes With Covid-19:17', '179426:Conclusion:25', '211125:Discussion:27', '211125:Abstract:1', '179426:Effect Of Sars Cov-2 On Blood Glucose ::: Special Aspects Of Pathophysiology Of Diabetes And Relationship Of Anti-Diabetic Drugs In The Context Of Covid-19:11', '211125:Caption:30', '78018:Abstract:1', '214728:Cap Community-Acquired Pneumonia Covid-19 Coronavirus Disease-2019:7', '197804:Discussion:41', '214728:Cap Community-Acquired Pneumonia Covid-19 Coronavirus Disease-2019:2', '147333:Title:0', '78018:Title:0', '197804:Perceptions And Practices Of Hcp Towards Diabetes During Covid-19:16', '197804:Caption:72', '35198:Abstract:1', '197804:Caption:71', '99569:Abstract:1', '172581::6', '197804:Discussion:39', '197804:Discussion:55', '211125:Introduction:7', '214924:Diabetes Mellitus: A Risk Factor For The Progression Of Covid-19:13', '179426:Glycemic Control ::: Special Aspects Of Management Of Diabetes With Covid-19:18', '184360:Gliptins ::: Therapeutic Potential Of Targeting Dpp4 In Diabetic Patients With Covid-19:40', '214728:Title:0', '172581::5', '214728:Cap Community-Acquired Pneumonia Covid-19 Coronavirus Disease-2019:3', '211125:Discussion:24', '214924:Diabetes Mellitus And Covid-19: In The Eye Of The “Cytokine Storm” ::: Elucidating The Crosstalk Between Covid-19 And Diabetes Mellitus:19', '184360:Gliptins ::: Therapeutic Potential Of Targeting Dpp4 In Diabetic Patients With Covid-19:43', '214728:Cap Community-Acquired Pneumonia Covid-19 Coronavirus Disease-2019:1', '197804:Discussion:35', '179426:Abstract:1', '179426:Role Of Dpp4 Enzyme And Dpp4 Inhibitors ::: Special Aspects Of Pathophysiology Of Diabetes And Relationship Of Anti-Diabetic Drugs In The Context Of Covid-19:13', '214924:The Interplay Between Covid-19 And Ampk/Mtor Signaling Pathway In Diabetes Mellitus ::: Elucidating The Crosstalk Between Covid-19 And Diabetes Mellitus:22'}","{'211125', '184360', '99569', '214728', '147333', '197804', '172581', '78018', '214924', '104188', '179426', '35198', '114119'}","{'99569:Abstract', '197804:Perceptions And Practices Of Hcp Towards Diabetes During Covid-19', '179426:Abstract', '35198:Abstract', '179426:Blood Glucose Monitoring ', '211125:Discussion', '78018:Title', '197804:Discussion', '214728:Cap Community-Acquired Pneumonia Covid-19 Coronavirus Disease-2019', '114119:Abstract', '172581:', '197804:The Survey', '197804:Management Of Children And Young People With Diabetes Mellitus That Were Covid-19 Positive', '211125:Introduction', '179426:Glycemic Control ', '211125:Caption', '78018:Abstract', '214728:Title', '211125:Abstract', '179426:Effect Of Sars Cov-2 On Blood Glucose ', '214924:Angiotensin-Converting Enzyme 2 Expression In Diabetes Mellitus And Its Role In Covid-19 Infectivity ', '184360:Conclusion', '147333:Title', '214924:Diabetes Mellitus And Covid-19', '104188:Abstract', '214924:Diabetes Mellitus', '197804:Caption', '184360:Gliptins ', '179426:Role Of Dpp4 Enzyme And Dpp4 Inhibitors ', '179426:Conclusion', '214924:The Interplay Between Covid-19 And Ampk/Mtor Signaling Pathway In Diabetes Mellitus '}",http://purl.obolibrary.org/obo/NCIT_C2831,"A simple sugar monosaccharide having two isoforms, alpha and beta, with a chemical structure of C6H12O6 that acts as an energy source for both plants and animals by reacting with oxygen, generating carbon dioxide and water, and releasing energy.",Organic Chemical,"[('http://purl.obolibrary.org/obo/NCIT_C68479', 'Hexose'), ('http://purl.obolibrary.org/obo/NCIT_C68471', 'Monosaccharide'), ('http://purl.obolibrary.org/obo/NCIT_C68470', 'Dietary Carbohydrate'), ('http://purl.obolibrary.org/obo/NCIT_C344', 'Carbohydrate'), ('http://purl.obolibrary.org/obo/NCIT_C718', 'Organic Chemical'), ('http://purl.obolibrary.org/obo/NCIT_C1913', 'Drug or Chemical by Structure'), ('http://purl.obolibrary.org/obo/NCIT_C1908', 'Drug, Food, Chemical or Biomedical Material'), ('http://www.w3.org/2002/07/owl#Thing', ''), ('http://purl.obolibrary.org/obo/NCIT_C54060', 'Bioactive Food Component'), ('http://purl.obolibrary.org/obo/NCIT_C1930', 'Food Component'), ('http://purl.obolibrary.org/obo/NCIT_C1949', 'Food or Food Product')]",13,CHEMICAL,CHEMICAL
glucose metabolism disorder,"['glucose metabolism', 'glucose metabolism', 'glucose metabolism']","['PATHWAY', 'PATHWAY', 'PATHWAY', 'PATHWAY', 'PATHWAY', 'PATHWAY', 'PATHWAY', 'PATHWAY', 'PATHWAY', 'PATHWAY', 'PATHWAY', 'PATHWAY']","{'197804:Discussion:41', '214924:Angiotensin-Converting Enzyme 2 Expression In Diabetes Mellitus And Its Role In Covid-19 Infectivity ::: Elucidating The Crosstalk Between Covid-19 And Diabetes Mellitus:18', '179426:Role Of Dpp4 Enzyme And Dpp4 Inhibitors ::: Special Aspects Of Pathophysiology Of Diabetes And Relationship Of Anti-Diabetic Drugs In The Context Of Covid-19:13', '114119:Abstract:1'}","{'179426', '214924', '197804', '114119'}","{'197804:Discussion', '179426:Role Of Dpp4 Enzyme And Dpp4 Inhibitors ', '214924:Angiotensin-Converting Enzyme 2 Expression In Diabetes Mellitus And Its Role In Covid-19 Infectivity ', '114119:Abstract'}",http://purl.obolibrary.org/obo/NCIT_C53655,A metabolic disorder characterized by abnormal blood glucose levels.,Disease or Syndrome,"[('http://purl.obolibrary.org/obo/NCIT_C97089', 'Carbohydrate Metabolism Disorder'), ('http://purl.obolibrary.org/obo/NCIT_C3235', 'Metabolic Disorder'), ('http://purl.obolibrary.org/obo/NCIT_C53547', 'Non-Neoplastic Disorder by Special Category'), ('http://purl.obolibrary.org/obo/NCIT_C53529', 'Non-Neoplastic Disorder'), ('http://purl.obolibrary.org/obo/NCIT_C2991', 'Disease or Disorder'), ('http://purl.obolibrary.org/obo/NCIT_C7057', 'Disease, Disorder or Finding'), ('http://www.w3.org/2002/07/owl#Thing', ''), ('http://purl.obolibrary.org/obo/NCIT_C27565', 'Non-Neoplastic Endocrine Disorder'), ('http://purl.obolibrary.org/obo/NCIT_C3009', 'Endocrine System Disorder'), ('http://purl.obolibrary.org/obo/NCIT_C27551', 'Disorder by Site'), ('http://purl.obolibrary.org/obo/NCIT_C53531', 'Non-Neoplastic Disorder by Site')]",4,DISEASE,DISEASE
glyburide,"['diabetic', 'diabetic']","['DISEASE', 'DISEASE', 'DISEASE', 'DISEASE', 'DISEASE', 'DISEASE', 'DISEASE', 'DISEASE', 'DISEASE', 'DISEASE', 'DISEASE', 'DISEASE', 'DISEASE', 'DISEASE', 'DISEASE', 'DISEASE', 'DISEASE', 'DISEASE', 'DISEASE', 'DISEASE', 'DISEASE', 'DISEASE', 'DISEASE', 'DISEASE', 'DISEASE', 'DISEASE', 'DISEASE', 'DISEASE', 'DISEASE', 'DISEASE', 'DISEASE', 'DISEASE', 'DISEASE', 'DISEASE', 'DISEASE', 'DISEASE', 'DISEASE', 'DISEASE', 'DISEASE', 'DISEASE', 'DISEASE', 'DISEASE', 'DISEASE', 'DISEASE', 'DISEASE', 'DISEASE', 'DISEASE', 'DISEASE', 'DISEASE', 'DISEASE', 'DISEASE', 'DISEASE', 'DISEASE', 'DISEASE', 'DISEASE', 'DISEASE']","{'214924:Diabetes Mellitus And Covid-19: In The Eye Of The “Cytokine Storm” ::: Elucidating The Crosstalk Between Covid-19 And Diabetes Mellitus:20', '184360:Abstract:1', '114119:Abstract:1', '160564:Introduction:5', '179426:Morbidity And Mortality In Diabetic Cohorts With Covid-19:9', '211373:Introduction:4', '184360:Pathophysiology Of Covid-19: Pulmonar And Cardiovascular Complications ::: Introduction:13', '211373:Introduction:2', '184360:Gliptins ::: Therapeutic Potential Of Targeting Dpp4 In Diabetic Patients With Covid-19:45', '179426:Role Of Antidiabetic Drugs In Current Context ::: Special Aspects Of Pathophysiology Of Diabetes And Relationship Of Anti-Diabetic Drugs In The Context Of Covid-19:12', '179426:Morbidity And Mortality In Diabetic Cohorts With Covid-19:8', '197804:Caption:71', '184360:Gliptins ::: Therapeutic Potential Of Targeting Dpp4 In Diabetic Patients With Covid-19:39', '184360:Sdpp4 As Soluble Decoy Factor ::: Therapeutic Potential Of Targeting Dpp4 In Diabetic Patients With Covid-19:54', '184360:Cardiovascular Effects Of Sdpp4 Upregulation ::: Raas And Sdpp4 In Diabetes And Other Comorbidities:26', '179426:Association Of Diabetes With Acute Viral Pandemics In The Past:5', '184360:Gliptins ::: Therapeutic Potential Of Targeting Dpp4 In Diabetic Patients With Covid-19:50', '211125:Introduction:6', '160564:Data Extraction And Study Quality ::: Material And Methods:9', '211125:Discussion:24', '129074:Abstract:1', '214924:Diabetes Mellitus And Covid-19: In The Eye Of The “Cytokine Storm” ::: Elucidating The Crosstalk Between Covid-19 And Diabetes Mellitus:19', '184360:Gliptins ::: Therapeutic Potential Of Targeting Dpp4 In Diabetic Patients With Covid-19:44'}","{'184360', '129074', '211373', '160564', '197804', '214924', '179426', '211125', '114119'}","{'160564:Introduction', '211373:Introduction', '184360:Gliptins ', '197804:Caption', '114119:Abstract', '160564:Data Extraction And Study Quality ', '179426:Morbidity And Mortality In Diabetic Cohorts With Covid-19', '179426:Role Of Antidiabetic Drugs In Current Context ', '184360:Pathophysiology Of Covid-19', '184360:Abstract', '184360:Sdpp4 As Soluble Decoy Factor ', '214924:Diabetes Mellitus And Covid-19', '211125:Introduction', '211125:Discussion', '129074:Abstract', '184360:Cardiovascular Effects Of Sdpp4 Upregulation ', '179426:Association Of Diabetes With Acute Viral Pandemics In The Past'}",http://purl.obolibrary.org/obo/NCIT_C29076,"A sulfonamide urea derivative with antihyperglycemic activity that can potentially be used to decrease cerebral edema. Upon administration, glyburide binds to and blocks the sulfonylurea receptor type 1 (SUR1) subunit of the ATP-sensitive inwardly-rectifying potassium (K(ATP)) channels on the membranes of pancreatic beta cells. This prevents the inward current flow of positively charged potassium (K+) ions into the cell, and induces a calcium ion (Ca2+) influx through voltage-sensitive calcium channels, which triggers exocytosis of insulin-containing granules. In addition, glyburide also inhibits the SUR1-regulated nonselective cation (NC) Ca-ATP channel, melastatin 4 (transient receptor potential cation channel subfamily M member 4; (TRPM4)), thereby preventing capillary failure and brain swelling. SUR1-TRPM4 channels are formed by co-assembly of SUR1 with TRPM4 in neurons, astrocytes, and capillary endothelium during cerebral ischemia. Upon ischemia-induced ATP depletion, channels open which results in sodium influx, cytotoxic edema formation, capillary fragmentation and necrotic cell death. SUR1-TRPM4 is not expressed in normal, uninjured tissues.",Pharmacologic Substance,"[('http://purl.obolibrary.org/obo/NCIT_C97936', 'Sulfonylurea Antidiabetic Agent'), ('http://purl.obolibrary.org/obo/NCIT_C29711', 'Anti-diabetic Agent'), ('http://purl.obolibrary.org/obo/NCIT_C78276', 'Agent Affecting Digestive System or Metabolism'), ('http://purl.obolibrary.org/obo/NCIT_C1909', 'Pharmacologic Substance'), ('http://purl.obolibrary.org/obo/NCIT_C1908', 'Drug, Food, Chemical or Biomedical Material'), ('http://www.w3.org/2002/07/owl#Thing', '')]",9,DRUG,DRUG
glycosylated hemoglobin measurement,"['glycated hemoglobin', 'glycated hemoglobin', 'glycated hemoglobin']","['CHEMICAL', 'CHEMICAL', 'CHEMICAL', 'CHEMICAL', 'CHEMICAL', 'CHEMICAL', 'CHEMICAL', 'CHEMICAL', 'CHEMICAL']","{'184360:Gliptins ::: Therapeutic Potential Of Targeting Dpp4 In Diabetic Patients With Covid-19:41', '184360:Cardiovascular Effects Of Sdpp4 Upregulation ::: Raas And Sdpp4 In Diabetes And Other Comorbidities:25', '179426:Association Of Diabetes With Acute Viral Pandemics In The Past:5'}","{'179426', '184360'}","{'184360:Gliptins ', '184360:Cardiovascular Effects Of Sdpp4 Upregulation ', '179426:Association Of Diabetes With Acute Viral Pandemics In The Past'}",http://purl.obolibrary.org/obo/NCIT_C64849,A quantitative measurement of the amount of glycosylated hemoglobin present in a sample of blood.,Laboratory Procedure,"[('http://purl.obolibrary.org/obo/NCIT_C64848', 'Hemoglobin Measurement'), ('http://purl.obolibrary.org/obo/NCIT_C49286', 'Hematology Test'), ('http://purl.obolibrary.org/obo/NCIT_C74944', 'Clinical Pathology Procedure'), ('http://purl.obolibrary.org/obo/NCIT_C25294', 'Laboratory Procedure'), ('http://purl.obolibrary.org/obo/NCIT_C25218', 'Intervention or Procedure'), ('http://purl.obolibrary.org/obo/NCIT_C16203', 'Clinical or Research Activity'), ('http://purl.obolibrary.org/obo/NCIT_C43431', 'Activity'), ('http://www.w3.org/2002/07/owl#Thing', ''), ('http://purl.obolibrary.org/obo/NCIT_C64430', 'Protein or Enzyme Type Measurement'), ('http://purl.obolibrary.org/obo/NCIT_C49237', 'Chemistry Test')]",2,PROTEIN,PROTEIN
growth factor,"['growth factors', 'growth factors', 'growth factors']","['PROTEIN', 'PROTEIN', 'PROTEIN', 'PROTEIN', 'PROTEIN', 'PROTEIN']","{'179426:Role Of Dpp4 Enzyme And Dpp4 Inhibitors ::: Special Aspects Of Pathophysiology Of Diabetes And Relationship Of Anti-Diabetic Drugs In The Context Of Covid-19:13', '184360:Cardiovascular Effects Of Sdpp4 Upregulation ::: Raas And Sdpp4 In Diabetes And Other Comorbidities:23'}","{'179426', '184360'}","{'179426:Role Of Dpp4 Enzyme And Dpp4 Inhibitors ', '184360:Cardiovascular Effects Of Sdpp4 Upregulation '}",http://purl.obolibrary.org/obo/NCIT_C20424,"Growth Factors are extracellular signaling molecules (ligands) involved in control of target cell proliferation, cell survival, and cell differentiation. (NCI)","Amino Acid, Peptide, or Protein","[('http://purl.obolibrary.org/obo/NCIT_C20027', 'Protein, Organized by Function'), ('http://purl.obolibrary.org/obo/NCIT_C17021', 'Protein'), ('http://purl.obolibrary.org/obo/NCIT_C26548', 'Gene Product'), ('http://www.w3.org/2002/07/owl#Thing', '')]",2,PROTEIN,PROTEIN
h1n1,['h1n1'],"['ORGANISM', 'ORGANISM']","{'179426:Association Of Diabetes With Acute Viral Pandemics In The Past:5', '214924:The Interplay Between Covid-19 And Ampk/Mtor Signaling Pathway In Diabetes Mellitus ::: Elucidating The Crosstalk Between Covid-19 And Diabetes Mellitus:25'}","{'179426', '214924'}","{'179426:Association Of Diabetes With Acute Viral Pandemics In The Past', '214924:The Interplay Between Covid-19 And Ampk/Mtor Signaling Pathway In Diabetes Mellitus '}",,,,,2,ORGANISM,ORGANISM
hcp,['hcp'],"['DISEASE', 'DISEASE', 'DISEASE', 'DISEASE', 'DISEASE', 'CHEMICAL', 'DISEASE', 'DISEASE', 'DISEASE', 'DISEASE']","{'197804:Discussion:30', '197804:Discussion:34', '197804:Introduction:6', '197804:Discussion:62', '197804:Discussion:31', '197804:Abstract:1', '197804:Perceptions And Practices Of Hcp Towards Diabetes During Covid-19:14', '139943:Abstract:1', '197804:Discussion:49'}","{'197804', '139943'}","{'197804:Discussion', '197804:Introduction', '197804:Perceptions And Practices Of Hcp Towards Diabetes During Covid-19', '197804:Abstract', '139943:Abstract'}",,,,,2,DISEASE,DISEASE
headache,"['headache', 'headache', 'headache']","['DISEASE', 'DISEASE', 'DISEASE', 'DISEASE', 'DISEASE', 'DISEASE']","{'197804:Discussion:47', '214924:Introduction:6'}","{'214924', '197804'}","{'197804:Discussion', '214924:Introduction'}",http://purl.obolibrary.org/obo/NCIT_C34661,"Pain in various parts of the head, not confined to the area of distribution of any nerve.",Finding,"[('http://purl.obolibrary.org/obo/NCIT_C3837', 'Neurological Signs and Symptoms'), ('http://purl.obolibrary.org/obo/NCIT_C100104', 'Sign or Symptom'), ('http://purl.obolibrary.org/obo/NCIT_C3367', 'Finding'), ('http://purl.obolibrary.org/obo/NCIT_C7057', 'Disease, Disorder or Finding'), ('http://www.w3.org/2002/07/owl#Thing', ''), ('http://purl.obolibrary.org/obo/NCIT_C36280', 'Nervous System Finding'), ('http://purl.obolibrary.org/obo/NCIT_C36278', 'Finding by Site or System')]",2,DISEASE,DISEASE
heart,"['cardiac', 'cardiac', 'cardiac', 'cardiac', 'heart', 'heart', 'heart', 'heart']","['ORGAN', 'ORGAN', 'ORGAN', 'ORGAN', 'ORGAN', 'ORGAN', 'ORGAN', 'ORGAN', 'ORGAN', 'ORGAN', 'ORGAN', 'ORGAN', 'ORGAN', 'ORGAN', 'ORGAN', 'ORGAN', 'ORGAN', 'ORGAN', 'ORGAN', 'ORGAN', 'ORGAN', 'ORGAN', 'ORGAN', 'ORGAN', 'ORGAN', 'ORGAN', 'ORGAN', 'ORGAN', 'ORGAN', 'ORGAN', 'ORGAN', 'ORGAN', 'ORGAN', 'ORGAN', 'ORGAN', 'ORGAN', 'ORGAN', 'ORGAN', 'ORGAN', 'ORGAN', 'ORGAN', 'ORGAN', 'ORGAN', 'ORGAN', 'ORGAN', 'ORGAN', 'ORGAN', 'ORGAN', 'ORGAN', 'ORGAN', 'ORGAN', 'ORGAN', 'ORGAN', 'ORGAN', 'ORGAN', 'ORGAN', 'ORGAN', 'ORGAN', 'ORGAN', 'ORGAN', 'ORGAN', 'ORGAN', 'ORGAN', 'ORGAN', 'ORGAN', 'ORGAN', 'ORGAN', 'ORGAN']","{'211125:Study Design And Participants:9', '211125:Discussion:25', '184360:Diabetes As Promoter Of Severity And Mortality In Covid-19 ::: Introduction:3', '214924:Angiotensin-Converting Enzyme 2 Expression In Diabetes Mellitus And Its Role In Covid-19 Infectivity ::: Elucidating The Crosstalk Between Covid-19 And Diabetes Mellitus:15', '99569:Abstract:1', '211125:Discussion:23', '184360:Pathophysiology Of Covid-19: Pulmonar And Cardiovascular Complications ::: Introduction:9', '184360:Gliptins ::: Therapeutic Potential Of Targeting Dpp4 In Diabetic Patients With Covid-19:44', '184360:Caption:71', '197804:Discussion:42', '211125:Abstract:1', '184360:Cardiovascular Effects Of Ace-Ang Ii-At1R Axis Upregulation And Ang-(1-7)/Mas Axis Dowregulation ::: Raas And Sdpp4 In Diabetes And Other Comorbidities:22', '184360:Pathophysiology Of Covid-19: Pulmonar And Cardiovascular Complications ::: Introduction:10'}","{'184360', '99569', '197804', '214924', '211125'}","{'197804:Discussion', '184360:Caption', '211125:Study Design And Participants', '184360:Gliptins ', '99569:Abstract', '184360:Pathophysiology Of Covid-19', '211125:Abstract', '214924:Angiotensin-Converting Enzyme 2 Expression In Diabetes Mellitus And Its Role In Covid-19 Infectivity ', '184360:Diabetes As Promoter Of Severity And Mortality In Covid-19 ', '211125:Discussion', '184360:Cardiovascular Effects Of Ace-Ang Ii-At1R Axis Upregulation And Ang-(1-7)/Mas Axis Dowregulation '}",http://purl.obolibrary.org/obo/NCIT_C12727,A hollow organ located slightly to the left of the middle portion of the chest. It is composed of muscle and it is divided by a septum into two sides: the right side which receives de-oxygenated blood from the body and the left side which sends newly oxygenated blood to the body. Each side is composed of two chambers: the atrium (receiving blood) and ventricle (ejecting blood).,"Body Part, Organ, or Organ Component","[('http://purl.obolibrary.org/obo/NCIT_C13018', 'Organ'), ('http://purl.obolibrary.org/obo/NCIT_C12219', 'Anatomic Structure, System, or Substance'), ('http://www.w3.org/2002/07/owl#Thing', '')]",5,ORGAN,ORGAN
